{
  "schema": "pet-character-rig-manifest-v1",
  "characterId": "cat",
  "rigId": "cat-source-rig-v1",
  "rigFingerprint": {
    "algorithm": "pet-canonical-json-f64-v1+sha256",
    "canonicalization": "pet-canonical-json-f64-v1",
    "value": "518cf8f9fc29e5c8286f16cfe930ad022fbd2153dd8c3ef68121c8d7c58df0d7"
  },
  "rig": {
    "coordinateSystem": {
      "handedness": "right",
      "up": "+Y",
      "forward": "+Z",
      "units": "meter"
    },
    "motionRoot": "__motion_root__",
    "jointOrder": [
      "__motion_root__",
      "rootjoint",
      "root_01",
      "skn_back_1_02",
      "skn_back_2_03",
      "skn_back_3_04",
      "skn_back_4_05",
      "skn_neck_00",
      "skn_head_06",
      "hk_headtip_07",
      "skn_l_eye_08",
      "skn_l_eyepupil_09",
      "skn_l_eyelidup_010",
      "skn_l_eyeliddown_011",
      "skn_jaw_012",
      "skn_jaw_012_0",
      "skn_lipdown_013",
      "skn_lipup_014",
      "skn_l_lipside_015",
      "skn_l_eyebrowin_016",
      "skn_l_eyebrowout_017",
      "skn_teethup_018",
      "skn_teethdown_019",
      "skn_tongue_020",
      "skn_r_eye_021",
      "skn_r_eyepupil_022",
      "skn_r_eyelidup_023",
      "skn_r_eyeliddown_024",
      "skn_r_eyebrowin_025",
      "skn_r_eyebrowout_026",
      "skn_r_lipside_027",
      "skn_l_ear_028",
      "skn_l_ear_028_0",
      "skn_r_ear_029",
      "skn_head_06_0",
      "skn_l_shoulder_030",
      "skn_l_armup_031",
      "skn_l_armdown_032",
      "skn_l_hand_033",
      "skn_r_shoulder_034",
      "skn_r_armup_035",
      "skn_r_armdown_036",
      "skn_r_hand_037",
      "skn_back_4_05_0",
      "skn_back_3_04_0",
      "skn_l_legup_038",
      "skn_l_legdown_039",
      "skn_l_foot_040",
      "skn_l_toes_041",
      "skn_l_toes_041_0",
      "skn_l_foot_040_0",
      "skn_l_legdown_039_0",
      "skn_l_legup_038_0",
      "skn_r_legup_042",
      "skn_r_legdown_043",
      "skn_r_foot_044",
      "skn_r_toes_045",
      "skn_r_toes_045_0",
      "skn_r_foot_044_0",
      "skn_r_legdown_043_0",
      "skn_r_legup_042_0",
      "skn_tail_01_046",
      "skn_tail_02_047",
      "skn_tail_03_048",
      "skn_tail_04_049",
      "skn_tail_05_050",
      "skn_tail_06_051",
      "skn_tail_06_051_0",
      "skn_tail_05_050_0",
      "skn_tail_04_049_0",
      "skn_tail_03_048_0",
      "skn_tail_02_047_0",
      "skn_tail_01_046_0",
      "skn_back_1_02_0"
    ],
    "joints": [
      {
        "id": "__motion_root__",
        "parentIndex": -1,
        "restLocal": {
          "translation": [
            0.0,
            0.0,
            0.0
          ],
          "rotation": [
            0.0,
            0.0,
            0.0,
            1.0
          ],
          "scale": [
            1.0,
            1.0,
            1.0
          ]
        },
        "dofMask": {
          "translation": [
            false,
            false,
            false
          ],
          "rotation": [
            false,
            false,
            false
          ],
          "scale": [
            false,
            false,
            false
          ]
        },
        "semanticRole": "motion_root",
        "source": null
      },
      {
        "id": "rootjoint",
        "parentIndex": 0,
        "restLocal": {
          "translation": [
            0.0,
            0.0,
            0.0
          ],
          "rotation": [
            1.1102230246251565e-16,
            0.0,
            0.0,
            1.0
          ],
          "scale": [
            1.0,
            1.0,
            1.0
          ]
        },
        "dofMask": {
          "translation": [
            false,
            false,
            false
          ],
          "rotation": [
            false,
            false,
            false
          ],
          "scale": [
            false,
            false,
            false
          ]
        },
        "semanticRole": "joint",
        "source": {
          "skinIndex": 0,
          "skinJointIndex": 0,
          "nodeIndex": 5,
          "sourceName": "_rootJoint"
        }
      },
      {
        "id": "root_01",
        "parentIndex": 1,
        "restLocal": {
          "translation": [
            0.0,
            0.0,
            0.0
          ],
          "rotation": [
            0.0,
            0.0,
            0.0,
            1.0
          ],
          "scale": [
            1.0,
            1.0,
            1.0
          ]
        },
        "dofMask": {
          "translation": [
            false,
            false,
            false
          ],
          "rotation": [
            false,
            false,
            false
          ],
          "scale": [
            false,
            false,
            false
          ]
        },
        "semanticRole": "joint",
        "source": {
          "skinIndex": 0,
          "skinJointIndex": 1,
          "nodeIndex": 12,
          "sourceName": "ROOT_01"
        }
      },
      {
        "id": "skn_back_1_02",
        "parentIndex": 2,
        "restLocal": {
          "translation": [
            0.9138302206993103,
            10.425677299499512,
            -12.788507461547852
          ],
          "rotation": [
            0.6030065252176411,
            0.36881341520377425,
            0.6035811735821858,
            0.3688489693734092
          ],
          "scale": [
            1.0,
            1.0,
            1.0
          ]
        },
        "dofMask": {
          "translation": [
            false,
            false,
            false
          ],
          "rotation": [
            true,
            true,
            true
          ],
          "scale": [
            false,
            false,
            false
          ]
        },
        "semanticRole": "spine_base",
        "source": {
          "skinIndex": 0,
          "skinJointIndex": 2,
          "nodeIndex": 13,
          "sourceName": "SKN_back_1_02"
        }
      },
      {
        "id": "skn_back_2_03",
        "parentIndex": 3,
        "restLocal": {
          "translation": [
            6.550015449523926,
            -1.0658141036401503e-14,
            -8.326672684688674e-15
          ],
          "rotation": [
            8.645491246515038e-07,
            1.3039689331711e-05,
            0.08534054483619107,
            0.9963518410864112
          ],
          "scale": [
            1.0,
            1.0,
            1.0
          ]
        },
        "dofMask": {
          "translation": [
            false,
            false,
            false
          ],
          "rotation": [
            true,
            true,
            true
          ],
          "scale": [
            false,
            false,
            false
          ]
        },
        "semanticRole": "spine_lower",
        "source": {
          "skinIndex": 0,
          "skinJointIndex": 3,
          "nodeIndex": 14,
          "sourceName": "SKN_back_2_03"
        }
      },
      {
        "id": "skn_back_3_04",
        "parentIndex": 4,
        "restLocal": {
          "translation": [
            6.550015449523926,
            -3.552713678800501e-14,
            -1.0483613976930428e-11
          ],
          "rotation": [
            -3.6516549703729015e-07,
            -5.5076446814003766e-06,
            0.13314126143613503,
            0.9910970711654471
          ],
          "scale": [
            1.0,
            1.0,
            0.9999999999999999
          ]
        },
        "dofMask": {
          "translation": [
            false,
            false,
            false
          ],
          "rotation": [
            true,
            true,
            true
          ],
          "scale": [
            false,
            false,
            false
          ]
        },
        "semanticRole": "spine_mid",
        "source": {
          "skinIndex": 0,
          "skinJointIndex": 4,
          "nodeIndex": 15,
          "sourceName": "SKN_back_3_04"
        }
      },
      {
        "id": "skn_back_4_05",
        "parentIndex": 5,
        "restLocal": {
          "translation": [
            6.550015449523926,
            2.1316282072803006e-14,
            8.319955835389692e-11
          ],
          "rotation": [
            -2.15978021153356e-06,
            -3.25751965071416e-05,
            0.139204305812622,
            0.9902636821460323
          ],
          "scale": [
            1.0,
            1.0,
            1.0
          ]
        },
        "dofMask": {
          "translation": [
            false,
            false,
            false
          ],
          "rotation": [
            true,
            true,
            true
          ],
          "scale": [
            false,
            false,
            false
          ]
        },
        "semanticRole": "spine_upper",
        "source": {
          "skinIndex": 0,
          "skinJointIndex": 5,
          "nodeIndex": 16,
          "sourceName": "SKN_back_4_05"
        }
      },
      {
        "id": "skn_neck_00",
        "parentIndex": 6,
        "restLocal": {
          "translation": [
            6.550015449523926,
            5.3290705182007514e-14,
            1.4298784378752316e-11
          ],
          "rotation": [
            -0.07669807868800167,
            0.06810238205523768,
            -0.34783571098509414,
            0.9319279953126559
          ],
          "scale": [
            0.9999999999999999,
            1.0,
            1.0
          ]
        },
        "dofMask": {
          "translation": [
            false,
            false,
            false
          ],
          "rotation": [
            true,
            true,
            true
          ],
          "scale": [
            false,
            false,
            false
          ]
        },
        "semanticRole": "neck",
        "source": {
          "skinIndex": 0,
          "skinJointIndex": 6,
          "nodeIndex": 17,
          "sourceName": "SKN_neck_00"
        }
      },
      {
        "id": "skn_head_06",